<?xml version="1.0" encoding="UTF-8"?>
<database xmlns="http://myphpframework.com/xsd" xmlns:xsi="http://www.w3.org/2001/XMLSchema-instance" xsi:schemaLocation="http://myphpframework.com/xsd/ database.xsd">
   <name>test1</name>
   <engine>BOBISNOTANENGINE</engine>
   <server>
       <host>localhost</host>
       <port>3306</port>
       <access type="rw">
           <login>root</login>
           <password>124357</password>
       </access>
   </server>
   <server>
       <host>localhost</host>
       <port>3306</port>
       <access type="r">
           <login>root</login>
           <password>124357</password>
       </access>
       <access type="w">
           <login>root</login>
           <password>124357</password>
       </access>
   </server>
</database>
